questionText,topics
"My boyfriend moved in with me a few months ago. I love him, but his dog is wrecking my house. Every day we get home, there is a huge mess on the floor, and several things will be ripped up (including the couch). He's slowly eating all of the doors, and there will be food and poop everywhere. Even though I come home during all of my breaks to take him out, he still poops and pees in the house every chance. I can't financially afford to have the dog wrecking my house. I've tried talking to my boyfriend about the dog to try and come up with a solution, but it never ends well. The dog is the only thing we fight about because I want him out of the house and my boyfriend doesn't want to see him go. It’s not the dog fault though; I understand that. The dog is only a year old, and he isn't a bad dog. He's just too big of a dog for where he is; he should be a farm dog instead of a town dog. I don't hate the dog, but I just can't afford to continue having my house torn to pieces.",Relationships
"I'm a teenager, and I struggle with going out and talking to people. I feel awful about leaving home. I know I can't afford a therapist so I don't know what my problem is, but I think I might have social anxiety.",Anxiety
I think about death all the time because I feel so alone. I want someone to love and someone to love me.,Depression
I think about death all the time because I feel so alone. I want someone to love and someone to love me.,Depression
"It's not entirely true to say I enjoy being sad, but I always find a way to feel that way. I listen to sad music, read tragic stories, and, in a twisted way, like how bad it makes me feel. I focus on negative aspects of my life even if they aren't legitimate or I just make it seem negative.",Depression
"About two and a half months ago, I met a woman on a dating site. We went out on two dates, and then despite her original plans on how to pace and conduct the relationship, I ended up at her house on a the Friday night one week after our first date. We respectfully tried not to have sex, but after hours of trying to resist each other, we gave in and we had sex. After that, I slept at her house every night for almost two weeks. Then one day, she went to her family’s house on Thanksgiving and everything changed. Within the short time we were together, we got so close and serious really fast. We had finally found each other. We told each other that we loved each other all the time, even while we were making love. A few days after Thanksgiving, she told me that we would have to go back to her original plans of seeing each other much less frequently. I was very hurt and didn’t understand. Then another week later, she told me she couldn’t do it at all anymore. I was crushed!

A few days later, she tells me how much she’s missing me and “let’s get together for lunch” or something like that. Then about two weeks later, we finally get together one night and we were so hot for each other (in love, not just sex), but she confessed that the reason for the sudden distance was that the father of her very young child told her he wants to get back together and this totally messed with her. So for her child’s sake, she is now considering the possibility of allowing that to happen. She had told me all about him previously, and it is definite that she has little to no attraction to him, but she would do this putting herself in misery again for her child. Our love for each other is fully established and acknowledged, but she is torn and confused. She doesn’t even think it would work between them as she had to kick him out before for not fulfilling his role properly. I know she needs time, and all I can do is take care of myself. We have agreed to remain friends, and if this doesn’t work out for her, we will try again. I’m completely in love with her, and I’m in extreme pain.",Relationships
"I'm an early 20 something year-old virgin, and my boyfriend is in his early 20s with kids. He's cheated on me twice: once in the beginning and then four months ago. He wasn't use to dating a virgin and broke up with me three times because he wasn't sure. We both work at the same job (where we met) and it’s with the girl that works with us. I've been trying to get over it, but now my confidence and self-esteem are low, and sometimes I feel like he’ll do it again or that he's not ready to be with me. I think about it all over again when I see her. He says he's in love with me, and with the last time he cheated, it didn't feel right, and that's when he knew he had to stop because his feelings were for me. He's contacted her and told her he will not communicate with her because he's in a relationship with me.

How do I gain confidence? Should I let him go? If I let him go, I don't want to be sad about it being that we work together. I try to tell myself I'm beautiful every day, and I think I am a pretty attractive female with a great personality, but I don't like the fact that she works there.",Relationships
"I have experienced cycles of depression for the past four years, and it hits me harder every time it comes back. This past time, it was extremely debilitating, so I went on Wellbutrin. I could feel the effects of the medicine after the first week. A month and a half later, I decided that my depression was being caused by my own unwillingness to move forward and address my behaviors and thoughts that were keeping me in a place of despair. I became worried that the medicine was making me complacent and prohibiting me from working out what I needed to in my life to bring back true fulfillment. I stopped taking it a month ago and feel okay; a lot of the anxiety it was paired with has gone away. However, I still don't feel my sense of self has been completely regained, and I have days where I feel a zombie-like haze of having no interests or the ability to fully concentrate on anything. Is it better to continue letting time and good habits work out the remaining depression or should I go back on the medicine?",Depression
"About two and a half months ago, I met a woman on a dating site. We went out on two dates, and then despite her original plans on how to pace and conduct the relationship, I ended up at her house on a the Friday night one week after our first date. We respectfully tried not to have sex, but after hours of trying to resist each other, we gave in and we had sex. After that, I slept at her house every night for almost two weeks. Then one day, she went to her family’s house on Thanksgiving and everything changed. Within the short time we were together, we got so close and serious really fast. We had finally found each other. We told each other that we loved each other all the time, even while we were making love. A few days after Thanksgiving, she told me that we would have to go back to her original plans of seeing each other much less frequently. I was very hurt and didn’t understand. Then another week later, she told me she couldn’t do it at all anymore. I was crushed!

A few days later, she tells me how much she’s missing me and “let’s get together for lunch” or something like that. Then about two weeks later, we finally get together one night and we were so hot for each other (in love, not just sex), but she confessed that the reason for the sudden distance was that the father of her very young child told her he wants to get back together and this totally messed with her. So for her child’s sake, she is now considering the possibility of allowing that to happen. She had told me all about him previously, and it is definite that she has little to no attraction to him, but she would do this putting herself in misery again for her child. Our love for each other is fully established and acknowledged, but she is torn and confused. She doesn’t even think it would work between them as she had to kick him out before for not fulfilling his role properly. I know she needs time, and all I can do is take care of myself. We have agreed to remain friends, and if this doesn’t work out for her, we will try again. I’m completely in love with her, and I’m in extreme pain.",Relationships
"I broke up with him three weeks ago because I felt that he needed to be more respectful. He has since had a rebound relationship. He says he loves and misses me but refuses to see me. He says it's going to be too difficult to see me. Every time we talk, it feels like I'm being pushy to see him. He used to be so madly in love with me, but now, it seems like he couldn’t care less. I think I'm running him away.",Relationships
"My girlfriend and I have broken up and gotten back together numerous times in the past two years. We recently just broke up again last night on New Year’s Eve. When we break up, the very next day, she calls me and acts as if nothing has happened. She acts like everything is alright. This has been going on for two years. I do love her and care about her and her children a lot, but she seems really demanding as far as what she deserves from a man. She is always telling me that she deserves this and that from a man. It makes me feel like crap because I cannot give her everything that she wants. She told me one time that she wants a man who is going to be afraid to lose her. Is that a normal thing that women want, or should I just move on already? I am in my 30s and she is in her 40s.",Relationships
"I have been seeing this guy for a little over a year. Back in August, he asked for us to step back for now. Since then, he has still been in contact with me every day. We spent some time together over the holidays, but then I was gone for New Years with family. I came to find out that he put himself on a dating site. When I found out, I asked him about it, and he responded with this: “My apologies if I got my signals crossed, or if I wasn’t honest with you. You have helped me tons this past year and I am glad you are in my life. I didn’t realize you were still interested in dating. Again, my apologies.” Also, is it better to say that I want him in my life or that I want him as part of my life?",Relationships
"I'm a female freshman in high school, and this question is for my male best friend. At the start of freshman year, we dated for about a week before his parents ended it because they said he is too young to date. He has been dating a really sweet senior girl for a month or two. I have nothing against her except for the fact that she has Tim's heart. He is convinced that they are in love, and maybe they are, but I don't really believe him. 

Lately, Tim had been expressing concern about what is going to happen when Sally leaves for college at the end of term this year. He's been asking me to help him with Sally and what girls like to show her how much he loves her. But he's also been thinking about breaking up with her just so they won't have to deal with it when she leaves. He seems really torn up about it, and I want to know what to say to him and how to help him once she leaves. 

He knows that I still crush on him. He doesn't rub it in my face. He's a good guy, but I want to actually help him out and recover before we think about maybe another relationship between us. How do I do that when the time comes? How do I support him and show him that I'm here without wanting to hook up? How do I make him feel better? He is convinced he's never going to be able to love anyone ever again, which I think is ridiculous.",Relationships
"My girlfriend broke up with me five months ago because I said awful things to her one night for no reason of hers. I have been trying to get her back, but it isn’t easy. She is in her 50s and I am in my 40s. She is the one I want for my life, and this is killing me. Every day, I cry, and I am desperate for help.",Relationships
Why am I so afraid of it? I don't understand.,Anxiety
My partner seems to always get depressed over the fact that his kids have to see and go through the divorce process. It’s especially when the mother of his kids keeps making him feel bad and using the kids as an excuse to get back at him. I feel like just telling him to go back with his family and forget about me.,Relationships
"I was hanging out with my close guy friend. We started kissing, but afterwards, he said that we should just stay friends because he doesn't want to ruin anything. We both just got out of relationships. His was very sexual. I'm not a sexual person, and he knows that. I want to be with him, but I'm not ready for another relationship, and I don't know if he ever will want to be more than friends.",Relationships
I have severe anxiety and have tried everything. Everything makes it worst.The only thing that helps is my emotional support animal.,Anxiety
"I have been dating my boyfriend for a month, and we want a baby. We don't work or drive, and we haven't talked to our parents. What should we do?",Relationships
"I'm almost never happy. Half of the time, I don't feel anything. I find it easy to make myself feel nothing. I know I push people away because it’s easier. I just want answers. I'm sick of feeling this way. It’s ruining my relationships with people.",Depression
"I've been feeling worthless, unaccomplished, and so frustrated. I want to break things, hit myself, run away, kick, scream, and cry. I just want to be happy and outgoing again. I want to be able to take care of my daughter and live comfortably.",Depression
"I got involved with my best friend who is married but has been very unhappy for the last five years. We both fell in love and have been together for eight months. He left the house and filed for divorce. He decided to tell her about our relationship, and she is willing to forgive and work on things. This shook him. They have two kids together. He decided to put the divorce on hold. He left town for a month to get clarity on the situation and see a therapist.",Relationships
"I think I'm annoying and bothersome, but my girlfriend says I'm just fine. I don't think so, I think I'm stressing everyone else out",Anxiety
"I'm almost never happy. Half of the time, I don't feel anything. I find it easy to make myself feel nothing. I know I push people away because it’s easier. I just want answers. I'm sick of feeling this way. It’s ruining my relationships with people.",Depression
"I'm a little paranoid. My mind does get the best of me. One night, I put chairs under all of my door knobs because I thought someone might break in. I also think a lot, which is probably the reason for the paranoia. I can't stand loud noises, like the sound of cars going by. The grocery store is too noisy, and I feel like people are looking at me.",Anxiety
"My life is completely normal, yet I feel empty inside. I feel as if I already know why I'm alive: to reproduce and die.",Depression
"I think I'm annoying and bothersome, but my girlfriend says I'm just fine. I don't think so, I think I'm stressing everyone else out",Anxiety
"People have been calling me names, and I have had enough of it. I cannot stand it anymore I'm done. I have told someone this, and that is why I am writing this. The thoughts are awful.",Depression
"I was in a situation with a guy. He’s my brother’s friend and kind of like a brother to me. He invited me over to hang out, and then came on to me. I was instantly terrified to say no, and I gave in. I don't know what's wrong with me. I can't figure out why I'm afraid to say no. This is giving me a lot of guilt and depression.",Depression
"I feel like I am internally screaming all the time. Externally, I am calm, but I have this intense, unidentifiable emotion constantly. I don't feel sad. I don't cry a lot. I feel rather emotionally distant other than the internal screaming. It kind of feels like I'm a caged animal.",Depression
"I have not had a friend since I was 19. I don't go anywhere, and I have no job, all because I'm afraid of people.",Anxiety
"I was in a relationship with him for three years. My mom doesn't like it because she thinks I'm making a mistake. He got married a few months after we broke up, and now he is divorced. I forgave him for what he did in the past, and he says he’s sorry and he really loves me. I love him too, but is it bad that I'm giving him a second chance again?",Relationships
"I was anxious to go to middle school. I was afraid of what people might say about me, so when school started, I wasn't acting like myself. I was quiet, which I'm usually not. I didn't talk to anybody and didn't have any friends. Then a few years later, my grandma died. I really became depressed and stop going to school for a little. I hated myself and still do. I just need help. I need someone to care for me. I need someone to show that they care.",Depression
"I feel like I am internally screaming all the time. Externally, I am calm, but I have this intense, unidentifiable emotion constantly. I don't feel sad. I don't cry a lot. I feel rather emotionally distant other than the internal screaming. It kind of feels like I'm a caged animal.",Depression
"We’ve been together almost three years. We argue and he ends it by telling me he doesn’t love me. It's hurtful because I am all about resolving the problem, and he dwells on the issue even if I drop what he's done and just swallow my pride and say I am sorry. How can this be resolved? We have kids, and I don't want a broken family because we can't communicate.",Relationships
I have several issues like I don't like people. They make me sick. I have issues with talking to people. I feel like they are talking about me and making fun of me. I have felt this way for years. When I look people in the eyes I have voices that tell me to hurt them and if I don't stop looking at who I am talking to it gets so loud I can't hear what they are saying. I just stay away from people to avoid this. I look at people and think how I could hurt them. I feel like I am worthless and would be better off not in this world where I don't fit in. Every day I wake up it's like another day. Any info would be good.,Relationships
"I get so much anxiety, and I don’t know why. I feel like I can’t do anything by myself because I’m scared of the outcomes.",Anxiety
"We’ve been together almost three years. We argue and he ends it by telling me he doesn’t love me. It's hurtful because I am all about resolving the problem, and he dwells on the issue even if I drop what he's done and just swallow my pride and say I am sorry. How can this be resolved? We have kids, and I don't want a broken family because we can't communicate.",Relationships
"Me and the father of my child have been dating for a year. We had a big argument and at first he wanted to work it out. But with time he started asking others and they told him to leave me.
Now he wants me to wait on him to mature. He wants to talk to other people. Then come back in four years. He doesn't want to deal with me while I'm pregnant. He doesn't take me to the doctor or anything. I feel alone.  How do I handle this situation?",Relationships
"I get so much anxiety, and I don’t know why. I feel like I can’t do anything by myself because I’m scared of the outcomes.",Anxiety
"We’ve been together almost three years. We argue and he ends it by telling me he doesn’t love me. It's hurtful because I am all about resolving the problem, and he dwells on the issue even if I drop what he's done and just swallow my pride and say I am sorry. How can this be resolved? We have kids, and I don't want a broken family because we can't communicate.",Relationships
"I found out my boyfriend takes anti-depression medicine. Lately he's been saying he has a lot on his mind, and he needs time to think about us. We've only been dating 3 weeks but I like him a lot.",Relationships
"Whenever I have to speak in public or be in big crowds, I freak out. I get light-headed, sweaty, and I have trouble breathing.",Anxiety
"I get so much anxiety, and I don’t know why. I feel like I can’t do anything by myself because I’m scared of the outcomes.",Anxiety
"Whenever I have to speak in public or be in big crowds, I freak out. I get light-headed, sweaty, and I have trouble breathing.",Anxiety
"We’ve been together almost three years. We argue and he ends it by telling me he doesn’t love me. It's hurtful because I am all about resolving the problem, and he dwells on the issue even if I drop what he's done and just swallow my pride and say I am sorry. How can this be resolved? We have kids, and I don't want a broken family because we can't communicate.",Relationships
"I've been with him for a couple months. We will talk everyday and he will get mad over something I will say and not talk to me. We have our great moments, but I just need to focus on my personal situations, and I feel he is slowing me down with that. I still wanna be with him, but not now.",Relationships
"I've been with him for a couple months. We will talk everyday and he will get mad over something I will say and not talk to me. We have our great moments, but I just need to focus on my personal situations, and I feel he is slowing me down with that. I still wanna be with him, but not now.",Relationships
"I get so much anxiety, and I don’t know why. I feel like I can’t do anything by myself because I’m scared of the outcomes.",Anxiety
"I've been with him for a couple months. We will talk everyday and he will get mad over something I will say and not talk to me. We have our great moments, but I just need to focus on my personal situations, and I feel he is slowing me down with that. I still wanna be with him, but not now.",Relationships
"He isn't violent, but he has anger issues and deep insecurities. He's working on them and has improved. We started counseling, and he participated in one or two individual sessions, but we broke up again shortly thereafter. Now his constant questions and accusations are getting really draining.",Relationships
"He isn't violent, but he has anger issues and deep insecurities. He's working on them and has improved. We started counseling, and he participated in one or two individual sessions, but we broke up again shortly thereafter. Now his constant questions and accusations are getting really draining.",Relationships
"He isn't violent, but he has anger issues and deep insecurities. He's working on them and has improved. We started counseling, and he participated in one or two individual sessions, but we broke up again shortly thereafter. Now his constant questions and accusations are getting really draining.",Relationships
I blame my past relationship for it. I know it is bad to be this way. I want to get past it.,Relationships
I blame my past relationship for it. I know it is bad to be this way. I want to get past it.,Relationships
"I have no friends, no hobbies, and no interest in anything. I get annoyed with everything and everyone. I am always tired, i can sleep 8 hrs or 12 hrs and im still tired.  I don't know what to do. Is this normal?",Depression
I have a bad habit of thinking and worrying about what others may think of me. I really want to stop it and enjoy things.,Anxiety
"I live a normal life. I have tons of friends and family, but I feel lonely.",Depression
"I often get the feeling that I'm being watched, like video cameras are hidden wherever I am, even at home. I feel like people can see all that I do and are reading my thoughts. Things I read or hear on the radio seem to be about (or meant for) me, and people are talking about me when they whisper.",Anxiety
"I have absolutely nothing to do with my life but lay in bed on my phone or hangout with my one friend. I don't have a job, my family doesn't include me in anything, and I don't have many friends. I have nothing to do besides go on my phone. I miss talking to people in person instead of online. I don't even talk to my family in person even from the other room.",Depression
"I sleep a lot. Music changes my mood. I cry every Wednesday. My mind is like a maze that even I get lost in. I don't usually feel my true emotions, but instead, I get fake mirrored ones.",Depression
"I am not sure if I am depressed. I don't know how to bring it up to my parents, and that makes me miserable.",Depression
"I am not sure if I am depressed. I don't know how to bring it up to my parents, and that makes me miserable.",Depression
"I am on the track and softball team. My school is small, so I play all four sports it offers. I feel obligated to do track because I'm not a horrible runner, and my dad wants me to. The catch is is that the days before a track meet and the morning of, I get sick and cry.",Anxiety
"I am on the track and softball team. My school is small, so I play all four sports it offers. I feel obligated to do track because I'm not a horrible runner, and my dad wants me to. The catch is is that the days before a track meet and the morning of, I get sick and cry.",Anxiety
"I am not sure if I am depressed. I don't know how to bring it up to my parents, and that makes me miserable.",Depression
"I feel like I am not at a good state of mind. I'm very unsettled in my soul. I'm not happy with myself or the decisions I make, which makes me not happy with anyone else. I feel like a failure most of my days. I don't feel like I'm good at anything anymore. I feel like less of a person.",Depression
"In the last ten months, I've been kicked out, moved around three times, worked many jobs, stopped school to make money, had dad and mom get sick, was cheated on while pregnant, lost my baby, had relationship issues, and was betrayed. I can't get a job. I have no friends. I feel lonely and isolated. I've been dealing with all this by myself.",Depression
